<?xml version="1.0" encoding="UTF-8"?>
<!DOCTYPE chatdb SYSTEM "DBchat.dtd">
<chatdb>
    <listautenti>
        <user>
            <nickName></nickName>
            <password></password>
        </user>
        <user>
            <nickName></nickName>
            <password></password>
        </user>
    </listautenti>
    <listachat>
        <chat id="">
            <ChatMessage>
                <Content></Content>
                <Sender></Sender>
                <Receiver></Receiver>
            </ChatMessage>
            <ChatMessage>
                <Content></Content>
                <Sender></Sender>
                <Receiver></Receiver>
            </ChatMessage>
            <ChatMessage>
                <Content></Content>
                <Sender></Sender>
                <Receiver></Receiver>
            </ChatMessage>
            <ChatMessage>
                <Content></Content>
                <Sender></Sender>
                <Receiver></Receiver>
            </ChatMessage>
            <ChatMessage>
                <Content></Content>
                <Sender></Sender>
                <Receiver></Receiver>
            </ChatMessage>
            <ChatMessage>
                <Content></Content>
                <Sender></Sender>
                <Receiver></Receiver>
            </ChatMessage>
            <ChatMessage>
                <Content></Content>
                <Sender></Sender>
                <Receiver></Receiver>
            </ChatMessage>
            <ChatMessage>
                <Content></Content>
                <Sender></Sender>
                <Receiver></Receiver>
            </ChatMessage>
            <ChatMessage>
                <Content></Content>
                <Sender></Sender>
                <Receiver></Receiver>
            </ChatMessage>
            <ChatMessage>
                <Content></Content>
                <Sender></Sender>
                <Receiver></Receiver>
            </ChatMessage>
            <ChatMessage>
                <Content></Content>
                <Sender></Sender>
                <Receiver></Receiver>
            </ChatMessage>
            <ChatMessage>
                <Content></Content>
                <Sender></Sender>
                <Receiver></Receiver>
            </ChatMessage>
        </chat>
    </listachat>
</chatdb>